{
  "metadata": {
    "appearance": "dark",
    "attribution": "Adapted from the Catppuccin Mocha palette; Catppuccin palette authorship and marks remain with their respective owners.",
    "name": "Catppuccin Mocha"
  },
  "packageId": "org.catppuccin.mocha",
  "packageVersion": "1.0.0",
  "schemaVersion": 1,
  "tokens": {
    "accent": "#cba6f7",
    "background": "#1e1e2e",
    "border": "#585b70",
    "danger": "#f38ba8",
    "focus": "#b4befe",
    "info": "#89b4fa",
    "selection": "#585b70",
    "success": "#a6e3a1",
    "surface": "#181825",
    "surfaceElevated": "#313244",
    "syntaxComment": "#6c7086",
    "syntaxKeyword": "#cba6f7",
    "syntaxNumber": "#fab387",
    "syntaxString": "#a6e3a1",
    "terminalBackground": "#11111b",
    "terminalForeground": "#cdd6f4",
    "textMuted": "#7f849c",
    "textPrimary": "#cdd6f4",
    "textSecondary": "#bac2de",
    "warning": "#f9e2af"
  },
  "type": "theme"
}
